{"$schema":"https://json-schema.org/draft/2020-12/schema","title":"Oracle Lab Governance Amendment Handoff","type":"object","additionalProperties":false,"required":["schema_version","handoff_kind","generated_at","expires_at","bindings","disabled_capabilities","next_planning_entry_conditions","next_implementation_entry_conditions","handoff_digest"],"properties":{"schema_version":{"const":1},"handoff_kind":{"const":"governance_amendment_handoff"},"generated_at":{"type":"string","format":"date-time"},"expires_at":{"type":"string","format":"date-time"},"bindings":{"$ref":"#/$defs/bindings"},"disabled_capabilities":{"type":"array","minItems":12,"maxItems":12,"uniqueItems":true,"items":{"type":"string"}},"next_planning_entry_conditions":{"type":"array","minItems":10,"maxItems":10,"items":{"type":"string"}},"next_implementation_entry_conditions":{"type":"array","minItems":12,"maxItems":12,"items":{"type":"string"}},"handoff_digest":{"$ref":"#/$defs/digest"}},"$defs":{"digest":{"type":"string","pattern":"^sha256:[0-9a-f]{64}$"},"artifact":{"type":"object","additionalProperties":false,"required":["path","digest"],"properties":{"path":{"type":"string","pattern":"^[A-Za-z0-9._/-]+$"},"digest":{"$ref":"#/$defs/digest"}}},"bindings":{"type":"object","additionalProperties":false,"required":["manifest","results","context","report","report_markdown","controller_report","controller_report_markdown"],"properties":{"manifest":{"$ref":"#/$defs/artifact"},"results":{"$ref":"#/$defs/artifact"},"context":{"$ref":"#/$defs/artifact"},"report":{"$ref":"#/$defs/artifact"},"report_markdown":{"$ref":"#/$defs/artifact"},"controller_report":{"$ref":"#/$defs/artifact"},"controller_report_markdown":{"$ref":"#/$defs/artifact"}}}}}
