{"bindings":{"context":{"digest":"sha256:7b49e5badc300ee092254811bbeef954db8342ebc7d1129c9d8c23810306bce4","path":"docs/superpowers/evidence/p0-1/p0-1-context.json"},"controller_report":{"digest":"sha256:63c58e58ae0a598fe34e729014458cfabd7cb0c6e479383d27cde9b01698f1f2","path":"docs/superpowers/evidence/p0-1/controller-final-report.json"},"controller_report_markdown":{"digest":"sha256:6ddbea63576a8ac1f7f5995c7ba6a88ac46b55653b1f68711de51444d3a00b6f","path":"docs/superpowers/evidence/p0-1/controller-final-report.md"},"manifest":{"digest":"sha256:8e168cc6491805940ef2ae057356db8f455aa55f88cef0fe4c160a9c01d185b9","path":"docs/superpowers/evidence/p0-1/p0-1-exit-baseline.json"},"report":{"digest":"sha256:ad59891de8b1cf09b5583a014629af17815c3f2bfc72e4589a9f10a62ec0a2b7","path":"docs/superpowers/evidence/p0-1/p0-1-exit-report.json"},"report_markdown":{"digest":"sha256:b69922ce2ee75f838c35dee7e44c52bc4693f45f0c20630bfe11cf79fafef965","path":"docs/superpowers/evidence/p0-1/p0-1-exit-report.md"},"results":{"digest":"sha256:56382adc3686dc926cb052f80adfb1379183412513b09f9f967111266436718a","path":"docs/superpowers/evidence/p0-1/p0-1-command-results.json"}},"disabled_capabilities":["real_upstream_access","real_credentials","provider_internal_authority","profile_promotion","production_deployment","real_canary","direct_egress_trust","unverified_pinned_wire_claims","unsupported_negative_capabilities","expired_or_missing_negative_capabilities","unrestricted_capture","external_network_requests"],"expires_at":"2026-07-16T00:33:12.333Z","generated_at":"2026-07-15T00:33:12.333Z","handoff_digest":"sha256:db2bf41608c3cfad3b3f7c44ddc104fa2deab2e0455f0d6e624cfcf0f0293186","handoff_kind":"governance_amendment_handoff","next_implementation_entry_conditions":["p0_1_successor_receipt_valid","cc_gateway_p0_1_branch_merged_to_main","sub2api_p0_1_branch_merged_to_main","local_main_equals_muqihang_main_in_both_repositories","p0_1_artifact_and_sub2api_fix_ancestry_verified","historical_phase_0_and_post_integration_v2_receipts_valid","joint_local_chain_green_on_integrated_heads","b1_b3_expected_red_revalidated_for_phase_1","protected_gateway_production_and_real_canary_disabled","fresh_unexpired_p1_entry_baseline_and_context","b4_b6_expected_red_preserved_for_phase_4","p1_detailed_plan_independently_approved"],"next_planning_entry_conditions":["p0_1_successor_receipt_valid","cc_gateway_p0_1_branch_merged_to_main","sub2api_p0_1_branch_merged_to_main","local_main_equals_muqihang_main_in_both_repositories","p0_1_artifact_and_sub2api_fix_ancestry_verified","historical_phase_0_and_post_integration_v2_receipts_valid","joint_local_chain_green_on_integrated_heads","b1_b3_expected_red_revalidated_for_phase_1","protected_gateway_production_and_real_canary_disabled","fresh_unexpired_p1_entry_baseline_and_context"],"schema_version":1}
